{
  "schema_version": "mizan.receipt/0",
  "receipt_id": "rcpt_77a3e910",
  "created_at": "2026-06-01T18:31:00Z",
  "subject": {
    "agent_id": "agent-demo",
    "model": "claude-opus-4-8",
    "run_id": "run-002",
    "tool": null
  },
  "input": {
    "hash": "sha256:a4b5e39b6b7a53289cf8ca992b2cfbbf9bf13f7d645c71811810317c2327bfff",
    "summary": null
  },
  "output": {
    "hash": "sha256:e3b0c44298fc1c149afbf4c8996fb92427ae41e4649b934ca495991b7852b855",
    "summary": null
  },
  "decision": {
    "action": "blocked",
    "reason": "scan:mcpscan refused"
  },
  "execution": null,
  "claim": null,
  "verification": "not_applicable",
  "stages": [
    {
      "stage": "scan",
      "tool": "mcpscan",
      "ok": false,
      "changes": 0,
      "detail": {
        "findings": 1,
        "rule": "R-BIDI-001",
        "severity": "high"
      }
    }
  ],
  "signature": {
    "algorithm": "HMAC-SHA256",
    "key_id": "demo",
    "value": "6c59a007f01cbc2eb6d4dfb673804c5e9e2562fd3b33c7c874156cd45f5172f6"
  }
}
